{
  "$schema": "https://json-schema.org/draft/2020-12/schema",
  "$id": "https://tokito.ai/schemas/model.bundle-manifest.schema.json",
  "title": "Tokito Offline Model Bundle Manifest",
  "type": "object",
  "additionalProperties": false,
  "required": [
    "schema_version",
    "model_id",
    "model_revision",
    "capability",
    "runtime_revision",
    "supported_abis",
    "license",
    "artifacts"
  ],
  "properties": {
    "schema_version": { "const": 1 },
    "model_id": { "type": "string", "minLength": 1 },
    "model_revision": { "type": "string", "minLength": 1 },
    "capability": { "enum": ["dialogue", "vision", "voice", "embedding"] },
    "runtime_revision": { "type": "string", "minLength": 1 },
    "supported_abis": {
      "type": "array",
      "minItems": 1,
      "uniqueItems": true,
      "items": { "type": "string", "minLength": 1 }
    },
    "license": { "type": "string", "minLength": 1 },
    "vision_profiles": {
      "type": "array", "minItems": 1, "maxItems": 2,
      "items": {
        "type": "object", "additionalProperties": false,
        "required": ["task", "directory"],
        "properties": {
          "task": { "enum": ["board_pose", "component_segmentation"] },
          "directory": { "type": "string", "pattern": "^[a-zA-Z0-9_-]{1,64}$" }
        }
      }
    },
    "artifacts": {
      "type": "array",
      "minItems": 1,
      "items": {
        "type": "object",
        "additionalProperties": false,
        "required": ["path", "size_bytes", "sha256"],
        "properties": {
          "path": { "type": "string", "minLength": 1 },
          "size_bytes": { "type": "integer", "minimum": 1 },
          "sha256": { "type": "string", "pattern": "^[0-9a-f]{64}$" }
        }
      }
    }
  }
}
