{
  "schema_version": 1,
  "model_id": "tokito-dialogue-example",
  "model_revision": "not-yet-built",
  "capability": "dialogue",
  "runtime_revision": "1",
  "supported_abis": ["arm64-v8a"],
  "license": "apache-2.0",
  "artifacts": [
    {
      "path": "dialogue/model.gguf",
      "size_bytes": 1,
      "sha256": "0000000000000000000000000000000000000000000000000000000000000000"
    },
    {
      "path": "dialogue-model.manifest.json",
      "size_bytes": 1,
      "sha256": "0000000000000000000000000000000000000000000000000000000000000000"
    }
  ]
}
